Title,Version,Severity,Description
RHEL 8 must be a vendor-supported release.,RHEL-08-010000,high,"An operating system release is considered ""supported"" if the vendor continues to provide security patches for the product. With an unsupported release, it will not be possible to resolve security issues discovered in the system software.

Red Hat offers the Extended Update Support (EUS) add-on to a Red Hat Enterprise Linux subscription, for a fee, for those customers who wish to standardize on a specific minor release for an extended period. The RHEL 8 minor releases eligible for EUS are 8.1, 8.2, 8.4, 8.6, and 8.8. Each RHEL 8 EUS stream is available for 24 months from the availability of the minor release. RHEL 8.10 will be the final minor release overall. For more details on the Red Hat Enterprise Linux Life Cycle  visit https://access.redhat.com/support/policy/updates/errata/.
Note: The life-cycle time spans and dates are subject to adjustment."
RHEL 8 vendor packaged system security patches and updates must be installed and up to date.,RHEL-08-010010,medium,"Timely patching is critical for maintaining the operational availability, confidentiality, and integrity of information technology (IT) systems. However, failure to keep operating system and application software patched is a common mistake made by IT professionals. New patches are released daily, and it is often difficult for even experienced System Administrators to keep abreast of all the new patches. When new weaknesses in an operating system exist, patches are usually made available by the vendor to resolve the problems. If the most recent security patches and updates are not installed, unauthorized users may take advantage of weaknesses in the unpatched software. The lack of prompt attention to patching could result in a system compromise."
"RHEL 8 must implement NIST FIPS-validated cryptography for the following: To provision digital signatures, to generate cryptographic hashes, and to protect data requiring data-at-rest protections in accordance with applicable federal laws, Executive Orders, directives, policies, regulations, and standards.",RHEL-08-010020,high,"Use of weak or untested encryption algorithms undermines the purposes of using encryption to protect data. The operating system must implement cryptographic modules adhering to the higher standards approved by the federal government since this provides assurance they have been tested and validated.

RHEL 8 utilizes GRUB 2 as the default bootloader. Note that GRUB 2 command-line parameters are defined in the ""kernelopts"" variable of the /boot/grub2/grubenv file for all kernel boot entries. The command ""fips-mode-setup"" modifies the ""kernelopts"" variable, which in turn updates all kernel boot entries. 

The fips=1 kernel option needs to be added to the kernel command line during system installation so that key generation is done with FIPS-approved algorithms and continuous monitoring tests in place. Users must also ensure the system has plenty of entropy during the installation process by moving the mouse around, or if no mouse is available, ensuring that many keystrokes are typed. The recommended amount of keystrokes is 256 and more. Less than 256 keystrokes may generate a nonunique key.

Satisfies: SRG-OS-000033-GPOS-00014, SRG-OS-000125-GPOS-00065, SRG-OS-000396-GPOS-00176, SRG-OS-000423-GPOS-00187, SRG-OS-000478-GPOS-00223"
All RHEL 8 local disk partitions must implement cryptographic mechanisms to prevent unauthorized disclosure or modification of all information that requires at rest protection.,RHEL-08-010030,medium,"RHEL 8 systems handling data requiring ""data at rest"" protections must employ cryptographic mechanisms to prevent unauthorized disclosure and modification of the information at rest.

Selection of a cryptographic mechanism is based on the need to protect the integrity of organizational information. The strength of the mechanism is commensurate with the security category and/or classification of the information. Organizations have the flexibility to either encrypt all information on storage devices (i.e., full disk encryption) or encrypt specific data structures (e.g., files, records, or fields).

Satisfies: SRG-OS-000185-GPOS-00079, SRG-OS-000404-GPOS-00183, SRG-OS-000405-GPOS-00184"
RHEL 8 must display the Standard Mandatory DOD Notice and Consent Banner before granting local or remote access to the system via a ssh logon.,RHEL-08-010040,medium,"Display of a standardized and approved use notification before granting access to the operating system ensures privacy and security notification verbiage used is consistent with applicable federal laws, Executive Orders, directives, policies, regulations, standards, and guidance.

System use notifications are required only for access via logon interfaces with human users and are not required when such human interfaces do not exist.

The banner must be formatted in accordance with applicable DOD policy. Use the following verbiage for operating systems that can accommodate banners of 1300 characters:

""You are accessing a U.S. Government (USG) Information System (IS) that is provided for USG-authorized use only.

By using this IS (which includes any device attached to this IS), you consent to the following conditions:

-The USG routinely intercepts and monitors communications on this IS for purposes including, but not limited to, penetration testing, COMSEC monitoring, network operations and defense, personnel misconduct (PM), law enforcement (LE), and counterintelligence (CI) investigations.

-At any time, the USG may inspect and seize data stored on this IS.

-Communications using, or data stored on, this IS are not private, are subject to routine monitoring, interception, and search, and may be disclosed or used for any USG-authorized purpose.

-This IS includes security measures (e.g., authentication and access controls) to protect USG interests--not for your personal benefit or privacy.

-Notwithstanding the above, using this IS does not constitute consent to PM, LE or CI investigative searching or monitoring of the content of privileged communications, or work product, related to personal representation or services by attorneys, psychotherapists, or clergy, and their assistants. Such communications and work product are private and confidential. See User Agreement for details.""

Use the following verbiage for operating systems that have severe limitations on the number of characters that can be displayed in the banner:

""I've read & consent to terms in IS user agreem't.""

Satisfies: SRG-OS-000023-GPOS-00006, SRG-OS-000228-GPOS-00088"
RHEL 8 must display the Standard Mandatory DoD Notice and Consent Banner before granting local or remote access to the system via a graphical user logon.,RHEL-08-010050,medium,"Display of a standardized and approved use notification before granting access to the operating system ensures privacy and security notification verbiage used is consistent with applicable federal laws, Executive Orders, directives, policies, regulations, standards, and guidance.

System use notifications are required only for access via logon interfaces with human users and are not required when such human interfaces do not exist.

The banner must be formatted in accordance with applicable DoD policy. Use the following verbiage for operating systems that can accommodate banners of 1300 characters:

""You are accessing a U.S. Government (USG) Information System (IS) that is provided for USG-authorized use only.

By using this IS (which includes any device attached to this IS), you consent to the following conditions:

-The USG routinely intercepts and monitors communications on this IS for purposes including, but not limited to, penetration testing, COMSEC monitoring, network operations and defense, personnel misconduct (PM), law enforcement (LE), and counterintelligence (CI) investigations.

-At any time, the USG may inspect and seize data stored on this IS.

-Communications using, or data stored on, this IS are not private, are subject to routine monitoring, interception, and search, and may be disclosed or used for any USG-authorized purpose.

-This IS includes security measures (e.g., authentication and access controls) to protect USG interests--not for your personal benefit or privacy.

-Notwithstanding the above, using this IS does not constitute consent to PM, LE or CI investigative searching or monitoring of the content of privileged communications, or work product, related to personal representation or services by attorneys, psychotherapists, or clergy, and their assistants. Such communications and work product are private and confidential. See User Agreement for details.""

Satisfies: SRG-OS-000023-GPOS-00006, SRG-OS-000228-GPOS-00088"
RHEL 8 must display the Standard Mandatory DoD Notice and Consent Banner before granting local or remote access to the system via a command line user logon.,RHEL-08-010060,medium,"Display of a standardized and approved use notification before granting access to the operating system ensures privacy and security notification verbiage used is consistent with applicable federal laws, Executive Orders, directives, policies, regulations, standards, and guidance.

System use notifications are required only for access via logon interfaces with human users and are not required when such human interfaces do not exist.

The banner must be formatted in accordance with applicable DoD policy. Use the following verbiage for operating systems that can accommodate banners of 1300 characters:

""You are accessing a U.S. Government (USG) Information System (IS) that is provided for USG-authorized use only.

By using this IS (which includes any device attached to this IS), you consent to the following conditions:

-The USG routinely intercepts and monitors communications on this IS for purposes including, but not limited to, penetration testing, COMSEC monitoring, network operations and defense, personnel misconduct (PM), law enforcement (LE), and counterintelligence (CI) investigations.

-At any time, the USG may inspect and seize data stored on this IS.

-Communications using, or data stored on, this IS are not private, are subject to routine monitoring, interception, and search, and may be disclosed or used for any USG-authorized purpose.

-This IS includes security measures (e.g., authentication and access controls) to protect USG interests--not for your personal benefit or privacy.

-Notwithstanding the above, using this IS does not constitute consent to PM, LE or CI investigative searching or monitoring of the content of privileged communications, or work product, related to personal representation or services by attorneys, psychotherapists, or clergy, and their assistants. Such communications and work product are private and confidential. See User Agreement for details.""

Satisfies: SRG-OS-000023-GPOS-00006, SRG-OS-000228-GPOS-00088"
All RHEL 8 remote access methods must be monitored.,RHEL-08-010070,medium,"Remote access services, such as those providing remote access to network devices and information systems, which lack automated monitoring capabilities, increase risk and make remote user access management difficult at best.

Remote access is access to DOD nonpublic information systems by an authorized user (or an information system) communicating through an external, nonorganization-controlled network. Remote access methods include, for example, dial-up, broadband, and wireless.

Automated monitoring of remote access sessions allows organizations to detect cyber attacks and ensure ongoing compliance with remote access policies by auditing connection activities of remote access capabilities, such as Remote Desktop Protocol (RDP), on a variety of information system components (e.g., servers, workstations, notebook computers, smartphones, and tablets)."
"RHEL 8, for PKI-based authentication, must validate certificates by constructing a certification path (which includes status information) to an accepted trust anchor.",RHEL-08-010090,medium,"Without path validation, an informed trust decision by the relying party cannot be made when presented with any certificate not already explicitly trusted.

A trust anchor is an authoritative entity represented via a public key and associated data. It is used in the context of public key infrastructures, X.509 digital certificates, and DNSSEC.

When there is a chain of trust, usually the top entity to be trusted becomes the trust anchor; it can be, for example, a Certification Authority (CA). A certification path starts with the subject certificate and proceeds through a number of intermediate certificates up to a trusted root certificate, typically issued by a trusted CA.

This requirement verifies that a certification path to an accepted trust anchor is used for certificate validation and that the path includes status information. Path validation is necessary for a relying party to make an informed trust decision when presented with any certificate not already explicitly trusted. Status information for certification paths includes certificate revocation lists or online certificate status protocol responses. Validation of the certificate status information is out of scope for this requirement.

Satisfies: SRG-OS-000066-GPOS-00034, SRG-OS-000384-GPOS-00167"
"RHEL 8, for certificate-based authentication, must enforce authorized access to the corresponding private key.",RHEL-08-010100,medium,"If an unauthorized user obtains access to a private key without a passcode, that user would have unauthorized access to any system where the associated public key has been installed."
RHEL 8 must encrypt all stored passwords with a FIPS 140-2 approved cryptographic hashing algorithm.,RHEL-08-010110,medium,"Passwords need to be protected at all times, and encryption is the standard method for protecting passwords. If passwords are not encrypted, they can be plainly read (i.e., clear text) and easily compromised.

Unapproved mechanisms that are used for authentication to the cryptographic module are not verified and therefore cannot be relied upon to provide confidentiality or integrity, and DoD data may be compromised.

FIPS 140-2 is the current standard for validating that mechanisms used to access cryptographic modules utilize authentication that meets DoD requirements."
RHEL 8 must employ FIPS 140-2 approved cryptographic hashing algorithms for all stored passwords.,RHEL-08-010120,medium,"The system must use a strong hashing algorithm to store the password.

Passwords need to be protected at all times, and encryption is the standard method for protecting passwords. If passwords are not encrypted, they can be plainly read (i.e., clear text) and easily compromised."
The RHEL 8 shadow password suite must be configured to use a sufficient number of hashing rounds.,RHEL-08-010130,medium,"The system must use a strong hashing algorithm to store the password. The system must use a sufficient number of hashing rounds to ensure the required level of entropy.

Passwords need to be protected at all times, and encryption is the standard method for protecting passwords. If passwords are not encrypted, they can be plainly read (i.e., clear text) and easily compromised."
RHEL 8 operating systems booted with United Extensible Firmware Interface (UEFI) must require authentication upon booting into single-user mode and maintenance.,RHEL-08-010140,high,"If the system does not require valid authentication before it boots into single-user or maintenance mode, anyone who invokes single-user or maintenance mode is granted privileged access to all files on the system. GRUB 2 is the default boot loader for RHEL 8 and is designed to require a password to boot into single-user mode or make modifications to the boot menu."
RHEL 8 operating systems booted with a BIOS must require authentication upon booting into single-user and maintenance modes.,RHEL-08-010150,high,"If the system does not require valid authentication before it boots into single-user or maintenance mode, anyone who invokes single-user or maintenance mode is granted privileged access to all files on the system. GRUB 2 is the default boot loader for RHEL 8 and is designed to require a password to boot into single-user mode or make modifications to the boot menu."
RHEL 8 operating systems must require authentication upon booting into rescue mode.,RHEL-08-010151,medium,"If the system does not require valid root authentication before it boots into emergency or rescue mode, anyone who invokes emergency or rescue mode is granted privileged access to all files on the system."
The RHEL 8 pam_unix.so module must be configured in the password-auth file to use a FIPS 140-2 approved cryptographic hashing algorithm for system authentication.,RHEL-08-010160,medium,"Unapproved mechanisms that are used for authentication to the cryptographic module are not verified and therefore cannot be relied upon to provide confidentiality or integrity, and DoD data may be compromised.

RHEL 8 systems utilizing encryption are required to use FIPS-compliant mechanisms for authenticating to cryptographic modules. 

FIPS 140-2 is the current standard for validating that mechanisms used to access cryptographic modules utilize authentication that meets DoD requirements. This allows for Security Levels 1, 2, 3, or 4 for use on a general-purpose computing system."
RHEL 8 must prevent system daemons from using Kerberos for authentication.,RHEL-08-010161,medium,"Unapproved mechanisms that are used for authentication to the cryptographic module are not verified and therefore cannot be relied upon to provide confidentiality or integrity, and DoD data may be compromised.

RHEL 8 systems utilizing encryption are required to use FIPS-compliant mechanisms for authenticating to cryptographic modules.

The key derivation function (KDF) in Kerberos is not FIPS compatible.  Ensuring the system does not have any keytab files present prevents system daemons from using Kerberos for authentication.  A keytab is a file containing pairs of Kerberos principals and encrypted keys.

FIPS 140-2 is the current standard for validating that mechanisms used to access cryptographic modules utilize authentication that meets DoD requirements. This allows for Security Levels 1, 2, 3, or 4 for use on a general-purpose computing system."
The krb5-workstation package must not be installed on RHEL 8.,RHEL-08-010162,medium,"Unapproved mechanisms that are used for authentication to the cryptographic module are not verified and therefore cannot be relied upon to provide confidentiality or integrity, and DoD data may be compromised.

RHEL 8 systems utilizing encryption are required to use FIPS-compliant mechanisms for authenticating to cryptographic modules.

Currently, Kerberos does not utilize FIPS 140-2 cryptography.

FIPS 140-2 is the current standard for validating that mechanisms used to access cryptographic modules utilize authentication that meets DoD requirements. This allows for Security Levels 1, 2, 3, or 4 for use on a general-purpose computing system."
RHEL 8 must use a Linux Security Module configured to enforce limits on system services.,RHEL-08-010170,medium,"Without verification of the security functions, security functions may not operate correctly and the failure may go unnoticed. Security function is defined as the hardware, software, and/or firmware of the information system responsible for enforcing the system security policy and supporting the isolation of code and data on which the protection is based. Security functionality includes, but is not limited to, establishing system accounts, configuring access authorizations (i.e., permissions, privileges), setting events to be audited, and setting intrusion detection parameters.

This requirement applies to operating systems performing security function verification/testing and/or systems and environments that require this functionality."
RHEL 8 must have policycoreutils package installed.,RHEL-08-010171,low,"Without verification of the security functions, security functions may not operate correctly and the failure may go unnoticed. Security function is defined as the hardware, software, and/or firmware of the information system responsible for enforcing the system security policy and supporting the isolation of code and data on which the protection is based. Security functionality includes, but is not limited to, establishing system accounts, configuring access authorizations (i.e., permissions, privileges), setting events to be audited, and setting intrusion detection parameters.

Policycoreutils contains the policy core utilities that are required for basic operation of an SELinux-enabled system. These utilities include load_policy to load SELinux policies, setfile to label filesystems, newrole to switch roles, and run_init to run /etc/init.d scripts in the proper context."
A sticky bit must be set on all RHEL 8 public directories to prevent unauthorized and unintended information transferred via shared system resources.,RHEL-08-010190,medium,"Preventing unauthorized information transfers mitigates the risk of information, including encrypted representations of information, produced by the actions of prior users/roles (or the actions of processes acting on behalf of prior users/roles) from being available to any current users/roles (or current processes) that obtain access to shared system resources (e.g., registers, main memory, hard disks) after those resources have been released back to information systems. The control of information in shared resources is also commonly referred to as object reuse and residual information protection.

This requirement generally applies to the design of an information technology product, but it can also apply to the configuration of particular information system components that are, or use, such products. This can be verified by acceptance/validation processes in DoD or other government agencies.

There may be shared resources with configurable protections (e.g., files in storage) that may be assessed on specific information system components."
RHEL 8 must be configured so that all network connections associated with SSH traffic terminate after becoming unresponsive.,RHEL-08-010200,medium,"Terminating an unresponsive SSH session within a short time period reduces the window of opportunity for unauthorized personnel to take control of a management session enabled on the console or console port that has been left unattended. In addition, quickly terminating an idle SSH session will also free up resources committed by the managed network element.

Terminating network connections associated with communications sessions includes, for example, deallocating associated TCP/IP address/port pairs at the operating system level and deallocating networking assignments at the application level if multiple application sessions are using a single operating system-level network connection. This does not mean the operating system terminates all sessions or network access; it only ends the unresponsive session and releases the resources associated with that session.

RHEL 8 uses /etc/ssh/sshd_config for configurations of OpenSSH. Within the sshd_config, the product of the values of ""ClientAliveInterval"" and ""ClientAliveCountMax"" is used to establish the inactivity threshold. The ""ClientAliveInterval"" is a timeout interval in seconds after which if no data has been received from the client, sshd will send a message through the encrypted channel to request a response from the client. The ""ClientAliveCountMax"" is the number of client alive messages that may be sent without sshd receiving any messages back from the client. If this threshold is met, sshd will disconnect the client. For more information on these settings and others, refer to the sshd_config man pages.

Satisfies: SRG-OS-000163-GPOS-00072, SRG-OS-000126-GPOS-00066, SRG-OS-000279-GPOS-00109"
The RHEL 8 /var/log/messages file must have mode 0640 or less permissive.,RHEL-08-010210,medium,"Only authorized personnel should be aware of errors and the details of the errors. Error messages are an indicator of an organization's operational state or can identify the RHEL 8 system or platform. Additionally, Personally Identifiable Information (PII) and operational information must not be revealed through error messages to unauthorized personnel or their designated representatives.

The structure and content of error messages must be carefully considered by the organization and development team. The extent to which the information system is able to identify and handle error conditions is guided by organizational policy and operational requirements."
The RHEL 8 /var/log/messages file must be owned by root.,RHEL-08-010220,medium,"Only authorized personnel should be aware of errors and the details of the errors. Error messages are an indicator of an organization's operational state or can identify the RHEL 8 system or platform. Additionally, Personally Identifiable Information (PII) and operational information must not be revealed through error messages to unauthorized personnel or their designated representatives.

The structure and content of error messages must be carefully considered by the organization and development team. The extent to which the information system is able to identify and handle error conditions is guided by organizational policy and operational requirements."
